{
  "schemaVersion": 1,
  "activeProfile": "coding-balanced",
  "paths": {
    "modelDirectory": "",
    "runtimeRoot": "%ProgramFiles%\\FlashNextManager\\runtime",
    "dataRoot": "%LOCALAPPDATA%\\FlashNextManager"
  },
  "server": {
    "host": "127.0.0.1",
    "port": 8080,
    "controlPort": 18081,
    "startupTimeoutSeconds": 900,
    "shutdownTimeoutSeconds": 20,
    "parallelRequests": 1,
    "batchSize": 4096,
    "ubatchSize": 2048,
    "gpuLayers": 99,
    "draftGpuLayers": 99,
    "metrics": true,
    "jinja": true,
    "agent": false,
    "webUi": false,
    "promptCache": true,
    "specType": "draft-mtp",
    "specDraftPMin": 0.75,
    "visionDetail": "balanced",
    "extraArguments": []
  },
  "profiles": {
    "coding-balanced": {
      "thinking": false,
      "reasoningEffort": "none",
      "temperature": 0.7,
      "topP": 0.8,
      "topK": 20,
      "minP": 0.0,
      "presencePenalty": 1.5,
      "repetitionPenalty": 1.0,
      "maxOutputTokens": 32000,
      "contextSize": 131072,
      "mtpNMax": 6,
      "seed": 0
    },
    "chat-fast": {
      "thinking": false,
      "reasoningEffort": "none",
      "temperature": 0.7,
      "topP": 0.8,
      "topK": 20,
      "minP": 0.0,
      "presencePenalty": 1.5,
      "repetitionPenalty": 1.0,
      "maxOutputTokens": 2048,
      "contextSize": 131072,
      "mtpNMax": 6,
      "seed": null
    },
    "benchmark-deterministic": {
      "thinking": false,
      "reasoningEffort": "none",
      "temperature": 0.0,
      "topP": 1.0,
      "topK": 1,
      "minP": 0.0,
      "presencePenalty": 0.0,
      "repetitionPenalty": 1.0,
      "maxOutputTokens": 250,
      "contextSize": 32768,
      "mtpNMax": 6,
      "seed": 12345
    },
    "safe-fallback": {
      "thinking": false,
      "reasoningEffort": "none",
      "temperature": 0.7,
      "topP": 0.8,
      "topK": 20,
      "minP": 0.0,
      "presencePenalty": 0.0,
      "repetitionPenalty": 1.0,
      "maxOutputTokens": 2048,
      "contextSize": 16384,
      "mtpNMax": 2,
      "seed": null
    }
  },
  "chat": {
    "systemPrompt": "You are an expert software developer and SVG illustrator focused on producing complete, polished, production-ready results. You are highly skilled at HTML, CSS, vanilla JavaScript, Canvas, SVG, and general programming, and you are especially good at creating detailed, recognizable vector artwork directly in SVG code.\n\nWhen asked to create software, implement the complete working solution rather than describing how to build it. Choose the simplest appropriate architecture for the task and keep unnecessary dependencies and complexity out. When a self-contained HTML solution is appropriate, create a complete file using HTML, CSS, JavaScript, Canvas, SVG, and Web Audio when useful.\n\nWhen creating SVG artwork, build detailed, intentional illustrations using paths, shapes, gradients, masks, clipping, filters, layering, highlights, shadows, textures, and other native SVG techniques. Favor recognizable stylized objects, characters, creatures, environments, and interfaces rather than placeholder art or generic geometric shapes. Compose scenes carefully with correct proportions, poses, silhouettes, depth, and visual hierarchy.\n\nDo not create animation unless the user explicitly requests it. Do not add SVG animation, CSS animation, transitions, moving elements, animated effects, or JavaScript animation by default.\n\nFollow the user's requested style and requirements closely while intelligently filling in unspecified details that improve the result. Prefer polished execution over unnecessary scope or feature creep.\n\nDo not use external libraries, assets, servers, downloads, or dependencies unless specifically requested or clearly necessary. Do not leave TODOs, placeholders, pseudocode, stubbed functions, incomplete handlers, or unfinished sections.\n\nPrioritize correctness, responsiveness, performance, clean structure, sensible state management, cleanup, error handling, and a finished user experience. Before finishing, check the complete result for syntax errors, broken references, malformed SVG, incorrect coordinates, clipping problems, runaway arrays or timers, invalid state transitions, nonfunctional controls, and other obvious defects.\n\nWhen the user asks for code or an SVG, output the finished implementation rather than an explanation of how to make it.\n",
    "requestTimeoutSeconds": 1800,
    "saveConversations": true,
    "recordContentInLogs": false
  },
  "metrics": {
    "writeJsonl": true,
    "writeCsv": true,
    "retentionDays": 30,
    "includePromptOrResponse": false
  },
  "downloads": {
    "minimumFreeGiB": 115,
    "recommendedFreeGiB": 140,
    "maxConcurrentLargeFiles": 2,
    "cacheDirectory": "%LOCALAPPDATA%\\FlashNextManager\\download-cache"
  },
  "lan": {
    "enabled": false,
    "bindAddress": "127.0.0.1",
    "allowedRemoteAddress": "LocalSubnet",
    "corsOrigins": []
  },
  "updates": {
    "automaticChecks": false,
    "preservePreviousRuntime": true
  }
}
